{"generation":"f16352425af726ef5b2a1960902777b8fb724b91cadbd5e836c8c967d707015a","repositoryId":"987654321","schemaVersion":1,"streams":[{"latest":"36287837535-a1","runCount":2,"streamId":"main"},{"latest":"11-a1","runCount":1,"streamId":"pr-7"},{"latest":"36405830015-a1","runCount":1,"streamId":"pr-123"}],"versions":{"api":1,"changes":1,"prPointer":1,"release":"0.1.0","stream":1}}